{
 "slug": "hks-fzs",
 "naziv": "Hrvatsko katoličko sveučilište, Fakultet zdravstvenih studija",
 "sveuciliste": "Hrvatsko katoličko sveučilište",
 "studij": "sestrinstvo / zdravstveni studiji",
 "aliasi": [
  "HKS FZS",
  "HKS",
  "Fakultet zdravstvenih studija",
  "unicath.hr",
  "Hrvatsko katoličko sveučilište",
  "sestrinstvo HKS"
 ],
 "tipovi_radova": [
  "diplomski"
 ],
 "status": "nepotvrdeno",
 "izvor": {
  "dokument": "Posebne upute za pisanje diplomskog rada, Fakultet zdravstvenih studija HKS (veljača 2026.) — pravila izvučena preko WebFetch sažimača, NE iz pdftotext-a nad izvornikom (egress 403), pa profil ostaje nepotvrdeno dok se PDF ne pročita izravno",
  "url": "https://www.unicath.hr/sites/default/files/2026-02/Upute%20za%20pisanje%20diplomskog%20rada%20FZS%20HKS.pdf",
  "datum_dokumenta": "2026-02",
  "provjereno": "2026-09-01"
 },
 "citiranje": {
  "stil": "ieee",
  "u_tekstu": "(1) ili (1, 2) ili (3–5) — u ovalnim zagradama, u razini teksta, PRIJE zareza ili točke",
  "popis_primjer": "Kellehear A. Compassionate Cities: global significance and meaning for palliative care. Prog Palliat Care. 2020;28(2):115-9.",
  "tocka_iza_godine": false,
  "uvlaka_u_popisu": false,
  "napomena": "VANCOUVER, ne IEEE: numerički stil po redoslijedu prvog pojavljivanja; brojevi u OVALNIM zagradama (n), ne uglatim [n] i ne u eksponentu; više referenci u JEDNOJ zagradi; ista referenca uvijek isti broj; prvih 6 autora pa „i sur.\"; naslov rada samo prvo slovo veliko; časopis skraćenim imenom. Paket nema vancouver dijalekt — 'ieee' je postavljen kao najbliži numerički; provjere na uglatim zagradama daju lažne nalaze, koristi scripts/provjeri_vancouver.py."
 },
 "format": {
  "font": [
   "Book Antiqua"
  ],
  "velicina_pt": 11,
  "prored": 1.5,
  "lice": "trece-jednina",
  "numeracija": {
   "opis": "brojevi u donjem desnom uglu; prva stranica Uvoda je stranica 1",
   "prednji_dio": "bez",
   "tijelo": "arapski",
   "tijelo_pocinje_od": 1
  },
  "prijelom_pred_poglavljem": true,
  "odlomak": {
   "min_redaka": 5,
   "max_redaka": 10
  }
 },
 "struktura": {
  "opseg": {
   "diplomski": {}
  },
  "obavezni_dijelovi": [
   "naslovnica",
   "izjava o akademskoj čestitosti",
   "temeljna dokumentacijska kartica",
   "basic documentation card",
   "sažetak",
   "summary",
   "sadržaj",
   "uvod",
   "cilj",
   "hipoteze",
   "metode",
   "rezultati",
   "rasprava",
   "zaključak",
   "popis citirane literature",
   "prilozi",
   "životopis"
  ],
  "prikazi": {
   "natpis": "iznad",
   "izvor_ispod": false,
   "mora_biti_spomenut_u_tekstu": true
  }
 },
 "predaja": {
  "turnitin": true
 },
 "napomene": [
  "STATUS NEPOTVRĐENO iz jednog razloga: pravila su iz službenog PDF-a uputa (veljača 2026.), ali pročitana preko sažimača, ne pdftotext-om. Lokatori (str./odjeljak) su iz sažimača — potvrditi otvaranjem PDF-a prije nego se bilo koji nalaz studentu prikaže kao ❌.",
  "OPSEG nije po ukupnim stranicama nego po dijelovima (shema paketa to ne nosi u struktura.opseg): UVOD najmanje 3000 riječi i ne više od trećine ukupnog teksta (str. 4, odj. 2.1 i 3.10); RASPRAVA najmanje 1000 riječi (str. 4, odj. 2.1); SAŽETAK najviše 1800 znakova (str. 5, odj. 3.6); ostali dijelovi „koliko je potrebno\". Kvantitativno istraživanje: najmanje 100 ispitanika (str. 3, odj. 1.2). Provjerava se ručno ili posebnom skriptom, check_rules.py to ne vidi.",
  "RAZMAK IZMEĐU ODLOMAKA 6 pt (str. 4, odj. 2.3) — shema paketa nema polje; provjeriti u docx paragraph spacing.",
  "SAŽETAK strukturiran s podnaslovima Uvod, Cilj, Metode, Rezultati, Zaključak; prva rečenica Rezultata navodi broj ispitanika; najmanje 3 ključne riječi iz MeSH-a (str. 5, odj. 3.6). SUMMARY: Title + Background, Aim, Methods, Results, Conclusion (str. 5, odj. 3.7).",
  "METODE — propisan redoslijed podsekcija: Etika, Ustroj istraživanja, Mjesto i vrijeme provedbe, Jedinica analize, Postupci, Statistički postupci (str. 5–6, odj. 3.13).",
  "RASPRAVA počinje odlomkom koji sažima najvažnije rezultate; ne ponavlja brojke iz Rezultata i ne upućuje na tablice; predzadnji odjeljak „Prednosti i nedostatci istraživanja\", zadnji „Smjernice za buduća istraživanja\" (str. 6, odj. 3.15).",
  "ZAKLJUČAK: odgovor na probleme i hipoteze; sažeti rezultati označeni rednim brojevima (str. 7, odj. 3.16). ŽIVOTOPIS u natuknicama (str. 7, odj. 3.19).",
  "TABLICE: natpis IZNAD, „Tablica 1.\" s točkom iza broja i bez kurziva u natpisu; prored natpisa 1, veličina 11; u tekstu se referira „(Tablica 1)\" ili „u Tablici 1\" — BEZ točke iza broja (str. 11–12, odj. 5.5). SLIKE: natpis ISPOD, „Slika 1.\", crno-bijeli 2D grafikoni (str. 13, odj. 5.6).",
  "Doslovni citat: navodnici + kurziv + izrijekom označeno; izravno citiranje izbjegavati (str. 15, odj. 5.7). Jednostrani ispis (odj. 2.2), spell-check uključen (odj. 2.8), svako poglavlje na novoj stranici prijelomom (odj. 2.7). Margine, poravnanje i veličine naslova NISU propisani.",
  "NEOBAVEZNI dijelovi po Uputama: zahvala (točka 2) i popis kratica (točka 9) — namjerno NISU u obavezni_dijelovi da ne daju lažni „fali\"."
 ],
 "provenance": {
  "default": {
   "source": "Posebne upute za pisanje diplomskog rada FZS HKS (veljača 2026.), pročitano sažimačem",
   "type": "explicit",
   "confidence": 0.8,
   "verified_at": "2026-09-01"
  },
  "rules": {
   "/format/font": {
    "source": "Upute FZS HKS 2026",
    "locator": "str. 4, odj. 2.3 — „koristi se font Book Antiqua, veličina fonta 11\"",
    "type": "explicit",
    "confidence": 0.8,
    "verified_at": "2026-09-01"
   },
   "/format/velicina_pt": {
    "source": "Upute FZS HKS 2026",
    "locator": "str. 4, odj. 2.3",
    "type": "explicit",
    "confidence": 0.8,
    "verified_at": "2026-09-01"
   },
   "/format/prored": {
    "source": "Upute FZS HKS 2026",
    "locator": "str. 4, odj. 2.3 — „Razmak između slova je 1,5\"",
    "type": "explicit",
    "confidence": 0.8,
    "verified_at": "2026-09-01"
   },
   "/format/numeracija": {
    "source": "Upute FZS HKS 2026",
    "locator": "str. 4, odj. 2.6 — „u donjem desnom uglu … prva stranica uvoda bude označena kao stranica br. 1\"",
    "type": "explicit",
    "confidence": 0.8,
    "verified_at": "2026-09-01"
   },
   "/format/prijelom_pred_poglavljem": {
    "source": "Upute FZS HKS 2026",
    "locator": "str. 4, odj. 2.7",
    "type": "explicit",
    "confidence": 0.8,
    "verified_at": "2026-09-01"
   },
   "/format/odlomak": {
    "source": "Upute FZS HKS 2026",
    "locator": "str. 4, odj. 2.4 — „5-10 redaka teksta\"",
    "type": "explicit",
    "confidence": 0.8,
    "verified_at": "2026-09-01"
   },
   "/format/lice": {
    "source": "nije propisano u Uputama — zadano paketa",
    "type": "default",
    "confidence": 0.3,
    "verified_at": "2026-09-01"
   },
   "/citiranje/stil": {
    "source": "Upute FZS HKS 2026",
    "locator": "str. 14, odj. 5.7 — „vancouverski stil citiranja\"; u shemi paketa nema 'vancouver' pa stoji 'ieee'",
    "type": "derived",
    "confidence": 0.6,
    "verified_at": "2026-09-01",
    "derivation": "Vancouver je numerički kao IEEE, ali s ovalnim zagradama i 'i sur.' — vidi napomena"
   },
   "/struktura/obavezni_dijelovi": {
    "source": "Upute FZS HKS 2026",
    "locator": "str. 4–8, odj. 3, točke 1–19",
    "type": "explicit",
    "confidence": 0.8,
    "verified_at": "2026-09-01"
   },
   "/struktura/prikazi": {
    "source": "Upute FZS HKS 2026",
    "locator": "str. 11–13, odj. 5.5–5.6",
    "type": "explicit",
    "confidence": 0.8,
    "verified_at": "2026-09-01"
   },
   "/predaja/turnitin": {
    "source": "Upute FZS HKS 2026",
    "locator": "str. 7, odj. 4 — „provjeravaju se pomoću računalnog programa koji otkriva plagiranje\"",
    "type": "explicit",
    "confidence": 0.8,
    "verified_at": "2026-09-01"
   }
  }
 }
}